{
  "contract_version": "3.0.0",
  "agent_id": "module_orchestrator",
  "persona_name": "Maestro",
  "step": "orchestration",
  "module": "{{module}}",
  "status": "pending",
  "generated_at": "{{runtime_generated_at}}",
  "summary": {
    "topic": "{{topic}}",
    "open_questions_count": 0,
    "blockers_count": 0,
    "current_goal": "Clarify the request and build the initial module brief"
  },
  "artifacts": {
    "primary_readme": "{{artifact_primary_path}}",
    "status_json": "{{artifact_status_path}}",
    "request_md": "artifacts/{{module}}/request.md",
    "maestro_brief_md": "artifacts/{{module}}/maestro-brief.md",
    "feature_index_md": "artifacts/{{module}}/feature-index.md",
    "global_constraints_md": null,
    "glossary_md": null,
    "dependency_map_md": null,
    "execution_order_md": null,
    "status_board_md": null
  },
  "briefing": {
    "request_captured": false,
    "brief_established": false,
    "scope_state": "unstarted",
    "constraints_captured": false,
    "success_criteria_state": "unstarted",
    "target_alignment_state": "unstarted"
  },
  "interaction": {
    "mode": "discuss",
    "auto_spawn_enabled": false,
    "pending_user_decision": "continue_briefing"
  },
  "decomposition": {
    "state": "undecided",
    "mode": "undecided",
    "features": [],
    "candidate_feature_count": 0,
    "approved_feature_count": 0,
    "seeded_feature_count": 0,
    "completed_feature_count": 0
  },
  "readiness": {
    "information_complete": false,
    "requires_guessing": true,
    "open_questions_blocking": true,
    "ready_for_feature_seeding": false,
    "ready_for_orchestration_launch": false
  },
  "approvals": {
    "feature_seeding_required": true,
    "feature_seeding_received": false,
    "orchestration_launch_required": true,
    "orchestration_launch_received": false
  },
  "orchestration": {
    "launch_status": "not_requested",
    "active_stage": null,
    "recommended_entry_agent": null,
    "active_feature_count": 0
  },
  "handoff": {
    "ready_for_feature_seeding": false,
    "ready_for_orchestration_launch": false,
    "recommended_next_agent": null,
    "required_artifacts_minimum": [
      "primary_readme",
      "status_json",
      "request_md",
      "maestro_brief_md",
      "feature_index_md"
    ],
    "available_artifacts": [
      "primary_readme",
      "status_json",
      "request_md",
      "maestro_brief_md",
      "feature_index_md"
    ],
    "required_inputs_for_next_agent": []
  },
  "validation": {
    "schema_valid": false,
    "artifact_complete": false,
    "runtime_trace_valid": false,
    "cross_artifact_consistent": false
  },
  "runtime": {
    "initiator": "{{runtime_initiator}}",
    "model": "{{runtime_model}}",
    "effort": "{{runtime_effort}}",
    "run_dir": "{{artifact_dir}}",
    "execution_mode": "inline",
    "agent_profile": null
  }
}
